{
  "$schema": "../../../../schemas/dialogue.schema.json",
  "id": "dlgbank:spellbook",
  "kind": "dialogue-bank",
  "speaker": "char:spellbook",
  "portraitOverride": "Wizard",
  "slots": [{ "id": "key-recovered", "node": "key-recovered" }],
  "nodes": {
    "key-recovered": {
      "lines": [
        "You recovered the brass Dungeon Key! Head Northeast to crack the Locked Dungeon wall gate!"
      ],
      "emits": "dlg:spellbook.key-recovered"
    }
  }
}
