{
  "$schema": "../../../../schemas/dialogue.schema.json",
  "id": "dlgbank:dungeon-guard",
  "kind": "dialogue-bank",
  "speaker": "char:dungeon-guard",
  "portraitOverride": "Skeleton",
  "slots": [
    { "id": "taunt", "node": "taunt" }
  ],
  "nodes": {
    "taunt": {
      "lines": ["Fools! None survive the Obsidian Throne dungeon! Prepare to perish!"],
      "emits": "dlg:dungeon-guard.taunt"
    }
  }
}
